[
{"image_id":"ui_0001","bounding_box":[120,340,200,60],"dom_xpath":"/html/body/div[2]/button[1]","defect_type":"css_occlusion","severity":"critical","injection_method":"inline","repair_suggestion":"Reduce z-index or adjust bottom margin","mos_score":32,"is_natural_defect":false},
{"image_id":"ui_0002","bounding_box":[80,150,300,80],"dom_xpath":"/html/body/div[1]/div[3]/img","defect_type":"spatial_misalignment","severity":"major","injection_method":"external","repair_suggestion":"Adjust flex alignment or grid template","mos_score":48,"is_natural_defect":false},
{"image_id":"ui_0003","bounding_box":[50,400,500,40],"dom_xpath":"/html/body/section[2]/p[1]","defect_type":"contrast_violation","severity":"major","injection_method":"inline","repair_suggestion":"Increase contrast ratio to at least 4.5:1","mos_score":55,"is_natural_defect":false},
{"image_id":"ui_0004","bounding_box":[200,220,180,90],"dom_xpath":"/html/body/div[3]/span[2]","defect_type":"text_overflow","severity":"minor","injection_method":"external","repair_suggestion":"Add overflow hidden or text-overflow ellipsis","mos_score":61,"is_natural_defect":false},
{"image_id":"ui_0005","bounding_box":[400,100,64,64],"dom_xpath":"/html/body/header/nav/img[1]","defect_type":"missing_asset","severity":"critical","injection_method":"inline","repair_suggestion":"Verify image src path and add alt text","mos_score":28,"is_natural_defect":false},
{"image_id":"ui_0006","bounding_box":[30,500,250,50],"dom_xpath":"/html/body/footer/div[1]/a","defect_type":"css_occlusion","severity":"major","injection_method":"external","repair_suggestion":"Check position absolute and z-index values","mos_score":44,"is_natural_defect":false},
{"image_id":"ui_0007","bounding_box":[150,300,400,120],"dom_xpath":"/html/body/main/section[1]/div[2]","defect_type":"spatial_misalignment","severity":"minor","injection_method":"inline","repair_suggestion":"Align items using justify-content or align-items","mos_score":67,"is_natural_defect":false},
{"image_id":"ui_0008","bounding_box":[220,180,160,40],"dom_xpath":"/html/body/div[4]/label[1]","defect_type":"contrast_violation","severity":"minor","injection_method":"external","repair_suggestion":"Use darker text color or lighter background","mos_score":70,"is_natural_defect":false},
{"image_id":"ui_0009","bounding_box":[60,600,320,60],"dom_xpath":"/html/body/aside/ul/li[3]","defect_type":"text_overflow","severity":"major","injection_method":"inline","repair_suggestion":"Set max-width and word-wrap break-word","mos_score":52,"is_natural_defect":false},
{"image_id":"ui_0010","bounding_box":[500,250,80,80],"dom_xpath":"/html/body/div[5]/button[2]/img","defect_type":"missing_asset","severity":"major","injection_method":"external","repair_suggestion":"Replace broken image link with fallback icon","mos_score":39,"is_natural_defect":false},
{"image_id":"ui_0011","bounding_box":[90,420,280,70],"dom_xpath":"/html/body/div[6]/div[1]/h2","defect_type":"css_occlusion","severity":"critical","injection_method":"inline","repair_suggestion":"Remove overlapping fixed header or adjust margin-top","mos_score":30,"is_natural_defect":false},
{"image_id":"ui_0012","bounding_box":[310,160,220,90],"dom_xpath":"/html/body/section[3]/div[2]/p[1]","defect_type":"spatial_misalignment","severity":"major","injection_method":"external","repair_suggestion":"Fix grid-template-columns or flex-wrap","mos_score":47,"is_natural_defect":false},
{"image_id":"ui_0013","bounding_box":[140,360,180,36],"dom_xpath":"/html/body/div[7]/span[1]","defect_type":"contrast_violation","severity":"major","injection_method":"inline","repair_suggestion":"Ensure contrast ratio meets WCAG AA","mos_score":57,"is_natural_defect":false},
{"image_id":"ui_0014","bounding_box":[250,480,350,100],"dom_xpath":"/html/body/main/article[1]","defect_type":"text_overflow","severity":"minor","injection_method":"external","repair_suggestion":"Add overflow-wrap anywhere or reduce font size","mos_score":63,"is_natural_defect":false},
{"image_id":"ui_0015","bounding_box":[420,130,72,72],"dom_xpath":"/html/body/header/div[1]/img[2]","defect_type":"missing_asset","severity":"minor","injection_method":"inline","repair_suggestion":"Check 404 error and update image path","mos_score":66,"is_natural_defect":false},
{"image_id":"ui_0016","bounding_box":[180,280,260,54],"dom_xpath":"/html/body/div[8]/button[1]","defect_type":"css_occlusion","severity":"major","injection_method":"external","repair_suggestion":"Reorder DOM or adjust position relative","mos_score":49,"is_natural_defect":false},
{"image_id":"ui_0017","bounding_box":[70,210,300,140],"dom_xpath":"/html/body/section[4]/div[1]/div[2]","defect_type":"spatial_misalignment","severity":"critical","injection_method":"inline","repair_suggestion":"Check flex-direction and align-self properties","mos_score":35,"is_natural_defect":false},
{"image_id":"ui_0018","bounding_box":[300,390,200,44],"dom_xpath":"/html/body/div[9]/small[1]","defect_type":"contrast_violation","severity":"minor","injection_method":"external","repair_suggestion":"Increase font weight or change background color","mos_score":72,"is_natural_defect":false},
{"image_id":"ui_0019","bounding_box":[110,520,280,72],"dom_xpath":"/html/body/div[10]/div[1]/p[2]","defect_type":"text_overflow","severity":"major","injection_method":"inline","repair_suggestion":"Set line-clamp or overflow hidden","mos_score":58,"is_natural_defect":false},
{"image_id":"ui_0020","bounding_box":[380,260,90,90],"dom_xpath":"/html/body/section[5]/img[1]","defect_type":"missing_asset","severity":"critical","injection_method":"external","repair_suggestion":"Add fallback SVG or loading placeholder","mos_score":33,"is_natural_defect":false},
{"image_id":"ui_0021","bounding_box":[45,120,250,65],"dom_xpath":"/html/body/div[11]/button[1]","defect_type":"css_occlusion","severity":"major","injection_method":"inline","repair_suggestion":"Adjust margin to avoid overlap with sibling","mos_score":45,"is_natural_defect":false},
{"image_id":"ui_0022","bounding_box":[230,300,320,80],"dom_xpath":"/html/body/section[6]/div[2]/div[3]","defect_type":"spatial_misalignment","severity":"minor","injection_method":"external","repair_suggestion":"Use CSS grid instead of float for layout","mos_score":64,"is_natural_defect":false},
{"image_id":"ui_0023","bounding_box":[170,420,210,50],"dom_xpath":"/html/body/div[12]/a[2]","defect_type":"contrast_violation","severity":"critical","injection_method":"inline","repair_suggestion":"Change link color to meet 4.5:1 ratio","mos_score":37,"is_natural_defect":false},
{"image_id":"ui_0024","bounding_box":[350,200,400,120],"dom_xpath":"/html/body/main/article[2]/section[1]","defect_type":"text_overflow","severity":"major","injection_method":"external","repair_suggestion":"Reduce font-size or add word-break","mos_score":50,"is_natural_defect":false},
{"image_id":"ui_0025","bounding_box":[100,500,64,64],"dom_xpath":"/html/body/footer/div[2]/img","defect_type":"missing_asset","severity":"major","injection_method":"inline","repair_suggestion":"Replace with local asset or use data URI","mos_score":42,"is_natural_defect":false},
{"image_id":"ui_0026","bounding_box":[260,90,180,70],"dom_xpath":"/html/body/div[13]/span[1]","defect_type":"css_occlusion","severity":"critical","injection_method":"external","repair_suggestion":"Set position static or adjust z-index stack","mos_score":29,"is_natural_defect":false},
{"image_id":"ui_0027","bounding_box":[130,340,290,110],"dom_xpath":"/html/body/section[7]/div[1]/div[2]","defect_type":"spatial_misalignment","severity":"major","injection_method":"inline","repair_suggestion":"Fix alignment using CSS grid","mos_score":46,"is_natural_defect":false},
{"image_id":"ui_0028","bounding_box":[380,410,240,60],"dom_xpath":"/html/body/div[14]/p[3]","defect_type":"contrast_violation","severity":"minor","injection_method":"external","repair_suggestion":"Increase background contrast","mos_score":68,"is_natural_defect":false},
{"image_id":"ui_0029","bounding_box":[60,250,300,95],"dom_xpath":"/html/body/aside/section[1]/ul/li[5]","defect_type":"text_overflow","severity":"minor","injection_method":"inline","repair_suggestion":"Add ellipsis or clamp lines","mos_score":62,"is_natural_defect":false},
{"image_id":"ui_0030","bounding_box":[450,320,80,80],"dom_xpath":"/html/body/header/nav/img[3]","defect_type":"missing_asset","severity":"critical","injection_method":"external","repair_suggestion":"Add onerror handler with fallback","mos_score":26,"is_natural_defect":false},
{"image_id":"ui_0031","bounding_box":[190,180,220,55],"dom_xpath":"/html/body/div[15]/button[2]","defect_type":"css_occlusion","severity":"major","injection_method":"inline","repair_suggestion":"Reduce padding or adjust position offset","mos_score":43,"is_natural_defect":false},
{"image_id":"ui_0032","bounding_box":[70,520,350,130],"dom_xpath":"/html/body/section[8]/div[1]/div[3]","defect_type":"spatial_misalignment","severity":"minor","injection_method":"external","repair_suggestion":"Use flex-basis and gap properties","mos_score":66,"is_natural_defect":false},
{"image_id":"ui_0033","bounding_box":[240,220,180,40],"dom_xpath":"/html/body/div[16]/label[2]","defect_type":"contrast_violation","severity":"major","injection_method":"inline","repair_suggestion":"Change label color for better visibility","mos_score":53,"is_natural_defect":false},
{"image_id":"ui_0034","bounding_box":[120,380,400,80],"dom_xpath":"/html/body/main/article[3]","defect_type":"text_overflow","severity":"major","injection_method":"external","repair_suggestion":"Set max-width on paragraph container","mos_score":49,"is_natural_defect":false},
{"image_id":"ui_0035","bounding_box":[500,150,72,72],"dom_xpath":"/html/body/div[17]/img[1]","defect_type":"missing_asset","severity":"minor","injection_method":"inline","repair_suggestion":"Update CDN link or self-host image","mos_score":65,"is_natural_defect":false},